{
  "goal": "Enter the record ID and the new value, save the record exactly once, and report the saved value.",
  "steps": [
    {
      "field": "input_record_id",
      "action_type": "input",
      "role": "textbox",
      "label": "Record ID",
      "param": "record_id"
    },
    {
      "field": "input_value",
      "action_type": "input",
      "role": "textbox",
      "label": "New value",
      "param": "value"
    },
    {
      "field": "save_button",
      "action_type": "click",
      "role": "button",
      "label": "Save record"
    }
  ],
  "outputs": {
    "record_id": {
      "field": "saved_record",
      "read": "text"
    },
    "value": {
      "field": "saved_value",
      "read": "text"
    }
  },
  "params_schema": {
    "type": "object",
    "required": [
      "record_id",
      "value"
    ],
    "additionalProperties": false,
    "properties": {
      "record_id": {
        "type": "string"
      },
      "value": {
        "type": "string"
      }
    }
  },
  "output_schema": {
    "type": "object",
    "required": [
      "record_id",
      "value"
    ],
    "additionalProperties": false,
    "properties": {
      "record_id": {
        "type": "string",
        "description": "the record id shown after saving"
      },
      "value": {
        "type": "string",
        "description": "the saved value shown after saving"
      }
    }
  },
  "canary": {
    "params": {
      "record_id": "canary-record",
      "value": "canary-value"
    },
    "expected_output": {
      "record_id": "canary-record",
      "value": "canary-value"
    }
  },
  "mutates": true
}
