{
  "goal": "Enter the permit identification number and applicant name, submit the application, and report the status shown.",
  "steps": [
    {
      "field": "input_permit_id",
      "action_type": "input",
      "role": "textbox",
      "label": "Permit identification number",
      "param": "permit_id"
    },
    {
      "field": "input_applicant_name",
      "action_type": "input",
      "role": "textbox",
      "label": "Applicant name",
      "param": "applicant_name"
    },
    {
      "field": "submit_button",
      "action_type": "click",
      "role": "button",
      "label": "Submit Application"
    }
  ],
  "outputs": {
    "status": {
      "field": "status_badge",
      "read": "text"
    },
    "inspector": {
      "field": "status_badge",
      "read": "attr:data-inspector"
    },
    "permit_id": {
      "field": "status_badge",
      "read": "attr:data-permit"
    }
  },
  "params_schema": {
    "type": "object",
    "required": [
      "permit_id",
      "applicant_name"
    ],
    "additionalProperties": false,
    "properties": {
      "permit_id": {
        "type": "string"
      },
      "applicant_name": {
        "type": "string"
      }
    }
  },
  "output_schema": {
    "type": "object",
    "required": [
      "status",
      "inspector",
      "permit_id"
    ],
    "additionalProperties": false,
    "properties": {
      "status": {
        "type": "string"
      },
      "inspector": {
        "type": "string"
      },
      "permit_id": {
        "type": "string"
      }
    }
  },
  "canary": {
    "params": {
      "permit_id": "PERMIT-2026-0042",
      "applicant_name": "Davis Municipal Works"
    },
    "expected_output": {
      "status": "Approved",
      "inspector": "Davis",
      "permit_id": "PERMIT-2026-0042"
    }
  }
}
